{
  "schema_version": "1.1.0",
  "source": {
    "filename": "balance_sheet_after_correction.pdf",
    "sha256": "0764bba6f5f0e7984a837e4cc19d8bb95db4a7ac22c26f18c95bbe652c983c74",
    "page_count": 1
  },
  "extractor": {
    "name": "pdfplumber",
    "version": "0.11.9",
    "method": "detected_cells_with_word_coordinate_fallback"
  },
  "pages": [
    {
      "page_index": 1,
      "extraction_method": "detected_cells",
      "width": 595.2,
      "height": 841.8,
      "table_bbox": [
        54.72,
        146.2197,
        524.6414,
        675.312
      ],
      "metadata": {
        "title_raw": "（１）連結貸借対照表",
        "currency": "JPY",
        "unit_raw": "千円",
        "unit_multiplier": 1000,
        "correction_marker_raw": "（訂正後）",
        "printed_page_number": 4,
        "columns": [
          {
            "id": "c1",
            "label_raw": "前連結会計年度",
            "date_raw": "(2025年３月31日)",
            "period": "2025-03-31",
            "source_bbox": [
              274.7045,
              146.2197,
              399.7445,
              675.312
            ]
          },
          {
            "id": "c2",
            "label_raw": "当連結会計年度",
            "date_raw": "(2026年３月31日)",
            "period": "2026-03-31",
            "source_bbox": [
              399.7445,
              146.2197,
              524.6414,
              675.312
            ]
          }
        ]
      },
      "rows": [
        {
          "id": "r001",
          "label_raw": "資産の部",
          "label": "資産の部",
          "depth": 0,
          "parent_id": null,
          "path": [
            "資産の部"
          ],
          "kind": "section",
          "label_x0": 62.28,
          "source_bbox": [
            54.72,
            146.2197,
            524.6414,
            158.4
          ],
          "label_source_bbox": [
            54.72,
            146.2197,
            274.7045,
            158.4
          ],
          "cells": {
            "c1": {
              "raw": "",
              "normalized": "",
              "value": null,
              "status": "blank",
              "negative_zero": false,
              "source_bbox": [
                274.7045,
                146.2197,
                399.7445,
                158.4
              ]
            },
            "c2": {
              "raw": "",
              "normalized": "",
              "value": null,
              "status": "blank",
              "negative_zero": false,
              "source_bbox": [
                399.7445,
                146.2197,
                524.6414,
                158.4
              ]
            }
          }
        },
        {
          "id": "r002",
          "label_raw": "流動資産",
          "label": "流動資産",
          "depth": 1,
          "parent_id": "r001",
          "path": [
            "資産の部",
            "流動資産"
          ],
          "kind": "section",
          "label_x0": 75.24,
          "source_bbox": [
            54.72,
            158.4,
            524.6414,
            170.4
          ],
          "label_source_bbox": [
            54.72,
            158.4,
            274.7045,
            170.4
          ],
          "cells": {
            "c1": {
              "raw": "",
              "normalized": "",
              "value": null,
              "status": "blank",
              "negative_zero": false,
              "source_bbox": [
                274.7045,
                158.4,
                399.7445,
                170.4
              ]
            },
            "c2": {
              "raw": "",
              "normalized": "",
              "value": null,
              "status": "blank",
              "negative_zero": false,
              "source_bbox": [
                399.7445,
                158.4,
                524.6414,
                170.4
              ]
            }
          }
        },
        {
          "id": "r003",
          "label_raw": "現金及び預金",
          "label": "現金及び預金",
          "depth": 2,
          "parent_id": "r002",
          "path": [
            "資産の部",
            "流動資産",
            "現金及び預金"
          ],
          "kind": "item",
          "label_x0": 88.2,
          "source_bbox": [
            54.72,
            170.4,
            524.6414,
            182.3997
          ],
          "label_source_bbox": [
            54.72,
            170.4,
            274.7045,
            182.3997
          ],
          "cells": {
            "c1": {
              "raw": "2,002,429",
              "normalized": "2,002,429",
              "value": 2002429,
              "status": "number",
              "negative_zero": false,
              "source_bbox": [
                274.7045,
                170.4,
                399.7445,
                182.3997
              ]
            },
            "c2": {
              "raw": "608,281",
              "normalized": "608,281",
              "value": 608281,
              "status": "number",
              "negative_zero": false,
              "source_bbox": [
                399.7445,
                170.4,
                524.6414,
                182.3997
              ]
            }
          }
        },
        {
          "id": "r004",
          "label_raw": "受取手形",
          "label": "受取手形",
          "depth": 2,
          "parent_id": "r002",
          "path": [
            "資産の部",
            "流動資産",
            "受取手形"
          ],
          "kind": "item",
          "label_x0": 88.2,
          "source_bbox": [
            54.72,
            182.3997,
            524.6414,
            194.4
          ],
          "label_source_bbox": [
            54.72,
            182.3997,
            274.7045,
            194.4
          ],
          "cells": {
            "c1": {
              "raw": "20,659",
              "normalized": "20,659",
              "value": 20659,
              "status": "number",
              "negative_zero": false,
              "source_bbox": [
                274.7045,
                182.3997,
                399.7445,
                194.4
              ]
            },
            "c2": {
              "raw": "26,333",
              "normalized": "26,333",
              "value": 26333,
              "status": "number",
              "negative_zero": false,
              "source_bbox": [
                399.7445,
                182.3997,
                524.6414,
                194.4
              ]
            }
          }
        },
        {
          "id": "r005",
          "label_raw": "売掛金",
          "label": "売掛金",
          "depth": 2,
          "parent_id": "r002",
          "path": [
            "資産の部",
            "流動資産",
            "売掛金"
          ],
          "kind": "item",
          "label_x0": 88.2,
          "source_bbox": [
            54.72,
            194.4,
            524.6414,
            206.4
          ],
          "label_source_bbox": [
            54.72,
            194.4,
            274.7045,
            206.4
          ],
          "cells": {
            "c1": {
              "raw": "2,019,476",
              "normalized": "2,019,476",
              "value": 2019476,
              "status": "number",
              "negative_zero": false,
              "source_bbox": [
                274.7045,
                194.4,
                399.7445,
                206.4
              ]
            },
            "c2": {
              "raw": "884,339",
              "normalized": "884,339",
              "value": 884339,
              "status": "number",
              "negative_zero": false,
              "source_bbox": [
                399.7445,
                194.4,
                524.6414,
                206.4
              ]
            }
          }
        },
        {
          "id": "r006",
          "label_raw": "電子記録債権",
          "label": "電子記録債権",
          "depth": 2,
          "parent_id": "r002",
          "path": [
            "資産の部",
            "流動資産",
            "電子記録債権"
          ],
          "kind": "item",
          "label_x0": 88.2,
          "source_bbox": [
            54.72,
            206.4,
            524.6414,
            218.3997
          ],
          "label_source_bbox": [
            54.72,
            206.4,
            274.7045,
            218.3997
          ],
          "cells": {
            "c1": {
              "raw": "564,667",
              "normalized": "564,667",
              "value": 564667,
              "status": "number",
              "negative_zero": false,
              "source_bbox": [
                274.7045,
                206.4,
                399.7445,
                218.3997
              ]
            },
            "c2": {
              "raw": "370,468",
              "normalized": "370,468",
              "value": 370468,
              "status": "number",
              "negative_zero": false,
              "source_bbox": [
                399.7445,
                206.4,
                524.6414,
                218.3997
              ]
            }
          }
        },
        {
          "id": "r007",
          "label_raw": "商品及び製品",
          "label": "商品及び製品",
          "depth": 2,
          "parent_id": "r002",
          "path": [
            "資産の部",
            "流動資産",
            "商品及び製品"
          ],
          "kind": "item",
          "label_x0": 88.2,
          "source_bbox": [
            54.72,
            218.3997,
            524.6414,
            230.4
          ],
          "label_source_bbox": [
            54.72,
            218.3997,
            274.7045,
            230.4
          ],
          "cells": {
            "c1": {
              "raw": "589,488",
              "normalized": "589,488",
              "value": 589488,
              "status": "number",
              "negative_zero": false,
              "source_bbox": [
                274.7045,
                218.3997,
                399.7445,
                230.4
              ]
            },